{
  "schema": "zaentrum.library.version/1",
  "id": "f13cfb12-e69b-588c-b10b-a99785850f44",
  "rev": 1,
  "createdAt": "2026-09-13T12:00:00Z",
  "createdBy": "example",
  "updatedAt": "2026-09-13T12:00:00Z",
  "updatedBy": "example",
  "workId": "0f3cd3cc-270c-511b-8650-c1a9710156ce",
  "primary": true,
  "edition": {
    "kind": "theatrical",
    "label": null,
    "decidedBy": "inferred",
    "decidedAt": "2026-09-13T12:00:00Z",
    "confidence": 0.6,
    "evidence": [
      {
        "signal": "runtime",
        "value": {
          "measuredMs": 734000,
          "referenceMs": 734000,
          "deltaMs": 0
        },
        "weight": 0.6
      }
    ]
  },
  "presentation": {
    "colour": "colour",
    "dynamicRange": "hdr10",
    "stereo3d": "none",
    "aspectRatio": "2.40:1",
    "colourDecision": {
      "decidedBy": "inferred",
      "confidence": 0.8,
      "evidence": [
        {
          "signal": "content-analysis",
          "value": {
            "method": "signalstats SATMAX",
            "samples": [
              {
                "atSec": 146,
                "satMax": 71
              }
            ]
          },
          "weight": 0.8
        }
      ]
    }
  },
  "runtime": {
    "measuredMs": 734000,
    "referenceMs": 734000,
    "deltaMs": 0
  },
  "completeness": {
    "status": "complete",
    "evidence": []
  },
  "master": {
    "fingerprint": "hevc/main10/10bit/hdr10/3840x1600",
    "fidelity": "original"
  },
  "packages": [
    {
      "id": "2b9c79e1-75f3-564c-9e12-78d6aef6e266",
      "document": "packages/2b9c79e1-75f3-564c-9e12-78d6aef6e266/package.json",
      "state": "complete",
      "lossless": false
    }
  ],
  "truth": {
    "kind": "source",
    "id": "c8c91e05-b8ad-5e9e-bb3d-003a6d8c90cb",
    "since": "2026-09-13T12:00:00Z",
    "note": "the original still exists"
  },
  "sources": [
    {
      "id": "c8c91e05-b8ad-5e9e-bb3d-003a6d8c90cb",
      "document": "source.json",
      "file": "source/tears_of_steel_4k.mkv",
      "state": "present",
      "part": null
    }
  ]
}
